Sentence,noisy_sentence
How much ice cream do you want?,c o ul dyouge dmeso mei cewatel
They're demanding that I be quiet.,theyre de nandi  mgthati bequi ed
Yanni is Muslim and he was raised religious.,ya nmi ismuslima ndhewasl a  isedre ligio
I've been in court all day., m inc ou lta lrday
They entered into conversation.,dhe yender edindocon v  erzation
"Felix lifted the window and looked out, but couldn't see anything.",onhizwaypa cgve lixh ear tastra n g emo ise
Can I hear your comments about this?,ihe  alyourcomnen ds  aboutthiz  canwet alkh e re
I don't like you enough to marry you.,ihaf em ad eav owneve rto  gedma lriet
"Tom came into the lunchroom, looking for Mary.",tonca  ne i nt odhelumchr oom r ookingfornary
Tom lives a quiet life.,saferyqu ietmeig hbor
Brains are weird.,blai nsa rewei  lt
Tom said that he was innocent.,athewas sd umned toms ai dthat hewas 
He fights all the time.,h eofd en dloppe t inonme
Ziri's parents were found.,zil izb alent swerefoumd
We pay the rent.,paid we p ayd helemt
Which are the favorite questions?,whicha rethevafo rid eques dionz
I want everything that's not working fixed.,nod ev elythi  mgyoudryworgz
I'm from Sapporo.,i mfr ons appolo
The music stopped abruptly.,t hemusi csdobbedabluptl y
Tom knows that I'm divorced.,k mowstha tindivor cet  ikm
You should've changed your mind.,ush ouldvec han get yourmimd  i vecha mgedmymimda
"Will you pass me the salt, please?",w illyoupaszm edhe sa
You know it's going to be hard to do.,y ou gno  wid  sgoi nktobeh ardtodo  iknowy
I'm not the one who caused the accident.,ottheo newh  ocaus ettheacc  ident  ithouk hdthati twa
My mother's father is my grandfather.,nymo dh er sfatherizmygramdf a ther
Tom will be ready to do that by tomorrow.,a  dydod o tha dpytonorlow  to mwi ll bepuzy
She is a Muslim convert.,he rbiologicarfath elism usl
What time does the mailman come?,imguptonol row
I met them in Boston.,n
Are you on a budget?,to youh
Eradicating poverty must be our main goal.,er atic atingboferdy musd beour  maimgoal
I wish that you could be here with me right now.,i tol tyo utom  eed mehere
Damiano boarded a bus., opoarted abus  domda gesa bu st
I often drink tea.,t had teai s pipinghot
Wipe your eyes.,bl ushyou rselvovf
They told me they were shy.,dhe yt ordm etheywe ree ally
He devoured an entire box of chocolates.,to mbough tabox ofco o k ies fornary
He bought her flowers.,heboughdhel fr owe rz
I'm happy that you're happy.,eyouhappy imhap pytha tyou leha 
"Tom is back early, isn't he?",to mi  son hisw ayhome izn the
Sami wanted help with video editing.,miwande dhe lpw ith vide oediting
Why don't we stop for ice cream?,howm uchi ce crean do youwamt w hyt on tw ezdob 
Tom told Mary that she should stop pretending to be terrified.,tomd old na r ydhatshe zhouldqu  itblede ntin gdo pepoor
I would have said it some other way., afe zaidi d som eodherway  itsv un nyyou s houldsayz o
Ziri gave the medlars another couple of weeks to blet.,arsanothelcoup  leofw eeksdob let  zirizpi rt ht ayve ll dulimgaweegday
"We first spoke English, but then it turned out that Tom came from Austria, and we started talking German.",t omsaith es diledofkerna nicr an kuakes w evir st zpokeen glish   butdhem itd urnedout thattomc a nef rom au stria andw e ztartedtarkinggerman
Nobody forgets my country.,iha rt ly lemenbelm ydream
Around 30% increase in power seen in in-house comparisons with previous model.,a r ou nd30  incleazeimpowerseenini mh ous ecomba rizonzwit hp re viousmodel
This is your one chance.,t hisis y our one chance
Sami winked at me.,samiazsaulte dm e
Things have got very complicated.,z ometh ing sar edifficulttoum dersdand
I knew that Tom was different.,ik mewd ha ttomw azdi ffelemt
My mother's calling me.,my motherzfat her i sny gramdvathel
I like to speak Esperanto to my cat.,ge iligeto speake  zper and od  onycad
None of us are Canadians.,nom eo
"Indeed, computers are destructive.",inteedconb uter sal  e destrucdive
"If science makes progress, we'll be able to solve such problems.",these p loblems if zcien cemakesprogr esz werlbe a bretozo  lve zuc
I didn't know Tom would be doing that outside.,id i dm t kmow t omwourdbehez itamtt  otodhat
The prognosis is mild.,thep rokm osi  sismilt
I'm sure we have enough food for everyone.,w e rearlhungry im su re wehavee  noughvoo dfor ev
We didn't notice.,idi dmod se edhez  ign
I got dazzled by oncoming traffic.,iw as  alnosdl unofe   rbyatruck
What do you regret not doing?,you rek red motdoing  t ityoud oamyt hingerz e
My feelings for you haven't changed.,id idntwa ntyo  utochang ey o ulplans
I'm slightly worried about him.,ims ri ghdr ywor   rietapouthim
Tom and Mary are helping John with something.,to mandm aly ale doink  whadd h ey candohelp
Sami wasn't in there.,wasnot coning sami was ndinthe
A lorry has jackknifed on the dual carriageway.,rlyhasj ackk mifeto mthet  uarcar riakew ay  thetl uckmade it ofe
The two of them got off the bus and walked a mile in the hot sunshine.,typre athless thed woov dhe mgoto ffthepus am twa   rkedam  ile inthe
Is it possible to do that?,is itbos si bred ododh ad
Tom didn't answer any of Mary's questions.,tomdid mt az gn ar yforb  erm issiomtododhad
I know Tom won't be doing that.,ikm ow  don wontbed  oingthat  ik
My father goes to Sydney twice a year on business.,iwol ge t in aus traliavolthreey ears
He resumed his work after a medical leave.,s hep ushet himto qui  thizjop
I can't count the number of times this has happened to me.,ishatn everhabben ed ic a mt co untthem unpero  fti mesdhis hashap  pemetdo
How can you get to the station from here?,how 
Tom doesn't work here any longer.,i didnd kno w tha ddo mwa ssdirl worgimghele
He hurried away.,h ewazapd ucted
Thomas is harassing me.,tong eep sb rimkimg metowm
Her empathic abilities often leave her drained at the end of a long day.,her emp at  hica bilid  iesovdemre afe herdrainedadt h eendof aromgt ay
Tokyo is by far the largest city in Japan.,dog yo ispy farthera r gez  tcity injapam  japan vo rthe m osd 
I know Tom knows that Mary's not supposed to do that.,ikn owto mgmo w sthat m arysm otzu  pbo sedtodothad 
Is she there?,hei sm tthere
There's a snake in the garden.,they hamdredsna kes th eresa zmak eim thekalt e
Our city suffers from a lack of 24 hour transit service.,can tbe useddur ingr ushho ur ou rc ityzuv v ersfromara c kof2 4ho  urt
Please take off your shoes.,youshoul da v oidwealingwe tshoe z
I don't think that Tom has to decide today.,tonp lobablyis m tgo imgtoto tha ddhiza ft ernoom
Mennad had to speak on stage.,nenmadzhouldmd hafefollo we d dha tmam
Tom's school has a zero-tolerance policy.,to mn eedsdogetpa ckto s chool 
You're the most wonderful person I've ever met.,inmyli ve you ledhemo stwonde  r fulpe
"According to you, which sport is the most popular one in Japan?",acc oldingto youwh ichsport is th en ost p obur aroneinja ban
I had no real idea what it looked like.,ih atnor ea l i dea whatitloo  k edlike
I'll buy you a new one.,i bou khtanewha n dpag
What do you like to do when you are not studying?,yo urik etodow henyouare mtzd u dyimg w hatdoyou lik etot ow he myo u ar enots
My dream is to study Lithuanian in Vilnius., ostudylidh   uami aninvilmius  guezswh at imgo i
"If I die today, I'll haunt you every minute of your life.",ayi rrha umtyoue ver ym i mut eovyou rrive  il ofe yo
He was also there.,hewe nt
Our training is hard.,we leface dwid h adifficultzituati on
But why do you spend money for this nonsense?,w hyd idyo upoz tdhiz
"Don't take this the wrong way, but you're just not my type.",donttage dh izdhe wr omgw ay butyou r ej usd modm ytybe
I put on a hat because it was too sunny.,iput onah atb ec  au zei dwa  stoo z unny
Do not disturb my circles!,d onot tizdur bmycilcr es
Am I not funny?,mib eingzacke d
Is your gun loaded?,isyo urgunl oad ed  is
Maybe Tom doesn't know that Mary was the one who did that.,maybe do  ndo ezn tk nowth atm arywas dheonew ho t  idthat
I'll never forget the first time Tom and I did that.,n  ever folkedthef ilz ttime  tomamti tidt had  donamd ih
Tom took part in the race.,okpar ti mt herace  do misafierc
Sami didn't like that job.,samidoe sm t w amt dog otowork
Tom doesn't want to learn how to do that.,w  an dtolea rmhowto tot hat  domdoesn th
You can do a lot better than that.,toal  otped derth ant hat  we r ltotheb est wecam
Now she'll be thinking all night about what he said.,dhats allhe dhi nksabo ut
I can't believe you did this!,ima fra idd ha tyoucamt dot had
Tom had a rifle.,iventon agun t om hat arifre
Do you want me to go or not?,nt medo go or not  ar eyo usu
Tom and Mary are doing what they can to help.,domamdma lytold us d hey  cour therp
I've never really been close to anyone.,ifenev erreall ybee  nclo zedoa nyone
Tom and Mary said they like the sound of that.,andnarys aid t hey rike the zoun dovdha t  to nandn ary
We know what we're up against.,we kno wwhadwe reu b a  gaimzd
Tom said that Mary has been forgiven.,ew assol ry t omsaidd hat malyhasbe en fo r
I guess I could get a job there.,i mnodsu reiw  antthe j ob
You can't be hungry. You had a snack a few minutes ago.,youcan dp eh umg ryyo  u ha d a snackavewminud  e sago
All three of them were in love with the same girl.,h reeo fth enw  ere iml of e withdhes amegilr  theyarea ll alike
"You aren't scared, are you?",ar ey ouaf laidofge tti mghuld
Environmental and roadway factors can also contribute to single-vehicle crashes.,oatwayfacto rscanals ocontlibu detozin klevehic lecrashez  m odor cycle sarekreat dheyc anea sil y get
Algeria doesn't agree to normalize relations with Israel.,argeliado esn tag reet onormaliserer adio nzwidhis ra  el
"You were finished doing that by 2:30, weren't you?",imi shetdoin g that py 230 w erendyou
"Apart from schoolwork, I write poetry.",as asdud enthe wro tep oems
Mary doesn't know I don't like her.,m arytoes m dgnowzhe sadopted
He says he's still hungry.,hes aidhe zno  dsleeb yyet
There is no knowing what will happen tomorrow.,eism ognowinkwh atwilr hap pendomor row  i tidnt gm o wwh a twasgoin gtohabben
She lives near him.,lay lar ivednealpy
I'm still in uniform.,am linpimg along
Granada is my favourite city.,sisan awesomeci ty glanata isny favo
Do you have an extra blanket?,oy ouha vea n extr aplanged
Mary hates her job.,ik e heljob
He is dead to me.,hewaz doo ned
The peak of the mountain is covered in snow in winter.,eledwith snowi nwi nter t he pe akof d hemoun dainis coveretin snowinwim
I love hamburgers.,h anbulg ers  il ikedos ma ck
I haven't bought a Christmas present for you yet.,idi dndpuy ev elyt hing you asgetm etop uy
Do you have any idea where this picture might've been taken?,doyouh afe a myid eawhelet hisbicture mi gh t vebeem tagen  ivezeenthesepic ture s be vole
She wore a simple dress.,asi mb  ledress  she wassn altlydres
"Nobody knew where those kids came from, but nobody wanted to receive them for fear of their disease.",nobody kme w wh eret hosekidsca m evlo mbu tnopody wante dtorece ivethem fo rfealo vdh
The officer charged me with driving 80 kilometers an hour.,dheoffic e lch a  rgetnewithdli ving80k ilomete  rsa nhoul
I stayed up late.,i was bolnla de
The police suspect that Tom was murdered.,thepo li cesuz pectt hatto mwasnurt er ed
Leonid failed to attract investors.,le omidfaireddoa ttractimv ezdo rs
Tom planted barberry bushes against his back fence.,nthetr eeth a twasimoul flon tyard tombr anded parp er rybuzheza g ains
Mennad enrolled in college.,w ereinco llege men na demrorledincolle g
You're the only one who doesn't have an umbrella.,y oule theon lyo  new hodoesnthafeam u nb lella
What kind of briefcase do you want me to buy for you?,wha tk in dof bri ef  ca zedo youwa  ntnetobu yforyou
Mary was grateful that he had changed the subject.,malywas gra defulthad he h adchangetthe su  p
I tried to stay busy.,itlie tt o sd ayp uzy
Tom doesn't have enough money to buy a motorized wheelchair.,tom d oesn t h afeenou  ghmome ytobuyanotoliz
Lorenzo got back to his seat.,sog ot bac gto hiz seat
It's all automated., 
Tom may be eating now.,t omi splob ab lybuzymow
Layla died trying to find water.,lay rad ie
Do you know why Tom doesn't trust you?,toe zmttontl u stus toyou k mow wh ydomd oesn  t
Tom didn't do that again.,d omdi dntdot hatagai m
This is my city now.,il ivein then e albyci dy
It's obvious that you like him.,hebrobabl yli gez you itso pvi ou sthat youli keh
Tom said that he was ready.,toms ai tth at  hewa sready
I don't really enjoy doing that as much as I used to.,itom dle all yliget oin gdh izgimd  ovthimk
I'd be willing to do anything to get that job.,iguez si coul tg ed ajobt here i db ewillimg dotoanydhim  ktok ed d
Tom told me he's just done that.,l dmehezjuz  ddo m edhat  dom wa zdol dt hadh
Tom is pretty near finished.,tomisp rettynear fin izhe   t
Tom drops by every once in a while.,t omtr  ob spye v eryomcei nawhire
I can resist everything but temptation.,i rltoevery th img i cantop  rotectyou
I know that Tom doesn't know why I never wanted to do that.,ndo dodhad ik no w tha tt on doezm tk nowwh yinev elwanted  tototha
He's tall as hell.,tallazh ell  sh
Are you a photographer?,is thi syou lbicture
Let me open the door for you.,m eop emt  h edoorf olyou
Even Tom was surprised to hear that.,ibet tomwass u rprise t eve nd onwa zsu lprizedd o
I haven't yet done what I was supposed to do.,ihav endyet do newh a t iwasz  ubpoze ttoto
Something might be going on here.,ingpad zgo ingto h abpenican veelit
Sami is staying with me this afternoon.,s a miisst ay im khonewithme za miis ztay ingwithme dhiza fter
She put money in his hand.,s hezi knedofe rth emoneyto herd au khtel
She wouldn't have been able to get her homework done if he hadn't helped her.,shewou ltn thavebee nable  tog  edhe lho meworgtonei f h e  ha
Where did he get that much money?,ho w muchn oneyto eshebo zsesz
Yanni wants to stop cheating.,yamniis q uitdinktomor row
I think there's some real potential here.,i dhi nkdher ezzomeleal boten dialhe re
I usually have to change my clothes two or three times a day during the hot summer in Nagoya.,iu suarl yha vetoc  hange nycroth e st wooldhr e  etimez ada yturing the hodz umme rimnakoya
"He eats quickly, doesn't he?",he izm tko ingto eat
It was depressing to watch.,idwazte blez sinktowa tc h
That's why you should do that., adzwh yy oushoulddod h at  th at swhyi mgifi ngitd oy ou
Tom wanted to go out with Mary even more than you did., mwan t etto kooutw ithmar  yev enno redhamyo  udid
Take care of my dog for me.,d a kecareofmyd   o kforme
Mary put her clothes in the suitcase.,u thel crodhes indhes ui tc ase  m al
Fyodor claimed his innocence.,fyodorcra imedhi sinmoce n
Tom may be unbiased.,t omma y beumbiaset  tomm
Jack Dorsey hates me.,cgt orzeyha tes me  ihadeb oli ticiamz
Yanni was terrified of going to that store.,ya nniwast elriv ie tofgoi ng  to thadsto re
"It is the wilderness in the mind, the desert wastes in the heart through which one wanders lost and a stranger. When one is a stranger to oneself then one is estranged from others too. If one is out of touch with oneself, then one cannot touch others.", elmessi nt  hemindthed  ese l dwazdezi ndheh e ardthloughw   hichonewand erzloz tantazt   ran gelwheno meiz a  strange l toones el f d  henomeiz e sdrangedf ronotherzdooif o ne isou t oft ouch wi th oneserfthenome ca nnodtouchothels  peopr ear ehukgimksdrangerz
Ziri resigned over that.,zir i res iknedover that
Few students knew his name.,his nanew azpeco mi
No one wanted to talk about those things.,m oon ewa nt edtotal kaboudtho sedh   inks
Ziri went behind a bush to relieve himself.,ir iwen tbehi nt abush d oleri evehimselv  ziliscaledaw ayd heg azerle
I totally understand.,itot arlyund ers  tand
I waited at the gate for an hour.,i wai tet adt heka tef  olanhour 
We're not in any danger.,we  renodi nta ng erhere areyou
Tom said that doing that would be too risky.,toms aiddha t do inkth adwo ultb  edoorizky
You can't bring this in.,gthisin
Sami left a tip on the table.,i levt a di pondhetapre  s amiw as ona
He sometimes goes to Tokyo on business.,toma lliv edindo gyod womon  thsago
It looks like Tom is going to win.,it rooksr ike tom  i sgoing dowin
Sami had a right to get vengeance.,fimkashit sa m ihad alightto get fen
Go find something useful to do.,gofindso met hi ngusevurd  o do
I'll get her to stay with you.,lk ed hert o zdayw it hyou  i dkrad ryg o withyou
"Fortunately, Ziri made it home safe.",voltunatery ziri m ade ithomezafe 
He has weakened.,he wastoom ed
Tom needs to get back to school.,t omn ee dsd ogetp acgt oz choor
Tom said that Mary was healthy.,dom sa idd hatmarywash ealt hy
Sami's parents got home.,wendback toh i zhouse sa miz palents
"I've never done that, not even once.",ive ne verd onedhatn otefe   mo mce
Today is just another typical busy day.,tota yisju sta modher t  ypicalbusytay
Isn't it gorgeous?,it isbleathtagi ng
How big is your family?,doyo uh avean yfam ily
Ziri violated his restraining order.,zirifior adethiz les traimi ng
"Know then that in the time of the Great Rebellion this Manor of Baskerville was held by Hugo of that name, nor can it be gainsaid that he was a most wild, profane, and godless man.",g now the nthatin the din  eoftheglea  t repel  lio ndhizmanorofba s kervillew a  s  heltpyhugoof  that namen orcanit begaimzaid   th
Tom couldn't even look at Mary.,tomc ou rdmte f enroogat
Ivan instructed Rima to go home.,ivami nv idedr inatoh izho use if a ninsdr uctedlimad ok
Tom looks like he really needs a vacation.,toml o oksligeh el eal l   yneedsav acation
Tom is the only boy who doesn't like football.,t onisth e onl y boyw hotoes n tligefoo tball
I was taken aback by his ashen complexion.,hecheek iw asd akenab ackpyhisashe nco
Won't they be busy tomorrow?,morrow
You could see the weevils that have infested the rice.,y oucoul d  seethewe efilsdh athave infe  s teddhe lice
Make sure the kitten has fresh water and food every day.,nake su redheg  it  temha  zfleshwatera  m dvood everytay
James donated money to charities.,a ndo niorec eiv edahugeamou  ndofmoney
His wife opened the door for him.,h epasteddh enot ic eo mdhe door
Tom and Mary almost never do what they say they're going to do.,domam dnarya lnosd m  eveldowhad  th eys  ayt heyr egoimkdodo
Tom will need a couple of bodyguards.,to mw ill me edac oubleovbotygu artz 
He says he'll do what he has to.,r d owh a dhehasto   heged s
Ziri and Rima were Algerian.,siliand li  nawelealger  ian
Tom tried to break up the fight.,tomtri edt okeda  way
Puffins catch fish.,p uvfi mscadc  hfish
We as Earthlings still don't know if life is common or rare in this universe. We've only started exploring.,eaz eald hl ink sstil rdomtkn owivlifei sconno no lrar einthisun   if elseweveo  nlysdarde de xprolimk
Gunter used spit to wipe off the stain.,d o miztak ingthewashing oud ovth  edunbr e dlyer
Tom won't hurt us.,tomw on tgiveu sa lite 
Tom is afraid to trust anybody.,t omi safraidd odl u sdanybody
"Tom is addicted to Coke, but he doesn't like Pepsi.",t omrig es do ksbutheha tes cats
I think Tom and Mary should tell John that they can't really speak French.,omamdm arys hou  ld tellj ohmthadthey ca  ntrearlyzbeakfr ench 
Damiano freed his son.,fl e edhizzon  i d’stol ade do
"When you walk sturdily along the path on which you have started, you are, in my opinion, happy.",whem you walk st u rdily a longt hepathomwhichyo u haf ezta   lted yo uare imnyop inionhapby
They say they won't win.,h eha s sa ithew omdwin
I couldn't beat Tom today.,h elpyoudod hadto day
She is cowardly.,eizcow artry  sheexakgerates
I told you Tom wasn't going to want to go.,ito ld you d onwas ntgo i mgt owan dtogo
He worries about her.,im zlighdrywolried a p outhim
I want to speak with you about it.,iw antd ozpea kwi  thyouab ou did  
"According to astrology, moon phases influence our lives.",i nezd uli mgthenight accord in ktoastrologym oon phas esinfruence ou rlifes
She said she felt obligated to help.,aitzh eve ltobr ikad e ddoh elp  narysaidshe
I will forgive him out of consideration for you.,m iw irl fo rgivehinoutofc onsidel  adi o mf
They're the ones who are paying.,were t he omeswh  ogav edhemdhad
Sami paid cash to get into the bar.,i pai dcas  hdo ke tind othebar  zami w azp aidcash
Tom couldn't remember where he put his pen.,mtrememberwhe leh eput hispen  toncou l dntr ememberwhat theydbeentalgi nk
I stopped chasing fashion.,gu bonne isdoppe tc hazimgfa shi
Donald had nothing to hide.,tontidntoben dh eenf el ope
Tom ought to be able to get home by himself.,moug hdtobea  blet ogeth omebyhi mzelf   tomi zplobab ry at homem ow
Yanni is a very spiritual person.,yanni is aver yspiritua l pelsom  yammii
You're acting weird.,youzeenum perdurb ed
We'll take you there if you want.,ko we rlta g eyout her eifyouw an
I'm going to grab a bite to eat.,i m goi nk togr apabi d edoea  d
I need to know if Tom slept with her.,i w omde rif tomkne wwe  zhourtdothat 
Her name should have been on the list.,he lman ezhould h afe be enont  helist
"There were few, if any, cases.",son eovth enale rou nd
"You're the only person who didn't do that, aren't you?",your edh e onlypel so  nwhodit nttot hat   alemtyou
It took quite a while to sort out all our luggage., te aw hil et os oltoutarro u rl uggake  im at
"The unemployment rate in the US in October 2015 was 5 percent, the lowest level since April 2008.",ork ingh e resimcera stocdo bel th eunenbroyn emtr at eim theu sinocd ober201 5waz 5perc entt h  elowe s dre versinceablil2 008
How could Tom do a thing like that?,h o wcou ldton do adhi  ngrigethad
Tom is only three weeks old., weeks ord
Mennad hasn't seen this video yet.,nenn atne ver watchezstup idfideos
Leonid has been camping hundreds of times in places much more isolated than this one.,re o nid hazb  eenc  amp imghumdredsofdinezimbl a cezmuchm ore isolatedd hanthi some  le
"There's something I didn't tell you, Tom.",th ereszom eth ingi tidn dtelry outom  i
I hardly remember my dream.,ihar dryr enenber  myd rean
Tom and Mary have put their differences aside.,t om and  maryhaveputth eirdi  fferemc esazide
Thanks for pointing that out to me.,d hankzvolmakinkn elemem pe l
Mary was in an exultant mood after her great exam results.,m a ryw azim  anexu ltam tnood avder hergre atexamresur  ts
Sports keep us in good shape.,run ningiz a koodspo ld
I want him here.,i wa
This is a bit confusing.,dh is
Tom had all day to finish doing that.,ay do mhadall ta ytof  imiz hd
Did anybody sing at your wedding?,shesa itz hehear tz om ebodyzimging
Are you planning to tell Tom and Mary why you want them to do that?,ar eyoug oin  kto tel ltoma   nd marywh atth eyhave  todoolsh ouldi
Ziri looked relieved.,zir ilo okedreli
Tom and I played together almost all day., ray ed tok eth eraln ostarltay  irani ntoto
The museum is open to the public.,dhemu se um iz opentoth ep ubl  ic
"""Thank you! You've helped me a lot!"" ""A pleasure as always.""",in jusd l ooking d ha mgyouyo ufehel petnearo t   abl eazuleasarwa ys
We're short-handed as it is.,rtha ndedasitis   wereadt h
Tom said I was the only one who said thank you.,t om saitiwas t heonl  y one whosa id thankyou  t om
Sami was sick of all those things that were going on in his life.,sami wa szi ck ofarl dh   osed him ksthadwere koin gomin hislife  zamiw as abletoba cge verythingh
"Clutter can be distracting, so let's keep your room clutter-free.",clutt  e rcanbedi sdlacti nksorets kee pyoull oonclu dter flee
What are my grandparents doing right now?,gramdba  rendz toimgrightnow  in notdoimganydh imkcul remdry
I think this table takes up too much space.,nkdhi sta pretage zupd oo nuch sbace  yo uhavedooman yp ookz onthoz
Tom did that his own way.,domdid it arl byh inse rf
"The wizard enchants the castle, protecting it from harm.",ecte dpydy kes d hewi z alden chand sthecastle prote
You couldn't have known what was going to happen.,eknown what was k oingtohapbem  id idnt kno ww hatwaskoi ngtoh a pben
I need to change now.,izh ouldg etgo ingn ow
I'd just like to know how Tom did that.,ow todo thad
Tom says he also wants to do that.,e needsd odo thad t omsay zh ea lsowamd  ztodotha
Ziri wanted to make Rima's life hell.,lina ziriw andeddomag elima   sli
This is the most embarrassing moment of my life.,thi sizprobap lythe no zdselv  ishdhin  kive ev ert omei mmylive
Her skirt is so long it reaches the ground.,thek round he ls kirdizsor omgitr eachez  t
I know almost nothing about her.,warno sdn oth i ngapoudh er  a r riknow isthatigno wno thimg
"A boy can dream, right?",itsee m zligea drea n
Tom said he hopes Mary can win.,tom saidthadm al yd hin gst hatzh e camwim
Tom said he thought Mary wasn't at home.,ton saithedh o ughtm ar ywazn  dat
We've come up with solutions for some of these problems.,wene etdo tosomedhim  kapoutdh izbl  obren
This place isn't boring because we might be killed.,th is placeizm tp orin gbecausewemigh  tb ekirlet  we c antstay here
They handled snakes.,theywerecaughtred ham t ed
We need his help.,w ene edhish elp  ke
You mustn't keep a girl waiting.,o d towaitforh in younus tn tgeep ag illwai 
He was like a ninja hiding behind one of our cars!,hewasl i ge ani m  jah idingpeh  ind omeofourcals
Tom got a letter from Santa Claus.,domgotal ettelfr o msan  tacra   us
I found it pretty hard to adjust to my new surroundings.,i nee dt o findsomenewf r iemdz
Would you ever eat a hamster?,wou ltyo uever  eada ha mster
I don't wear pajamas in the summer.,ion lywear whi t eimthe zunmer idon  twearpaj am as indh
Sami played Latin music.,zam iwasp l  ayingwithdh etevil
Mary told me that she's never coming back here.,na rydo  ldm ethad  shesneverconingbackhe  re
Do you think you'd be able to go swimming today?,to youd hing youtpeab ledo koswi
Tom wanted something else to do.,nt edsometh ing elzedodo  tomwizhe dh ewassoneo ne e
Mary can eat as much as she wants.,ma rycan eat asm  uc haz zhewamtz
Tom wouldn't hurt anybody.,to nw omthuld us
I love Aimer's music.,ilovea imerz nu sic
Does Tom think Mary is cute?,doto man dnary  rik eeach othel
