Sentence,noisy_sentence
Make a tight fist.,grab a ho l do fthelope
I'll put money in my pocket.,ife rdi  nny bocge tfolmywal l et
Tom will do anything for his friends.,fliemds
"However, maybe from the sudden change in pressure when you push them in, having your ears pop is a problem.", wev er may pe flomdhe  sud temc h a nke imprezsurewhen youp ushd hemi nh avi  mgyoulealzpopisaproplem  iha v ethatplopl emt oo
I don't think that Tom will be asleep when we get there.,i thimg donizgoi nkto b  etired wh enh eg ets home
"Ferhat Mehenni, the leader of a separatist groupuscule, got life in jail.",lhadnehenn i d h eleate r ofazebaradistkroup us culegotli fe imjail
The child was paralyzed with fear.,thechiltwazpar a ryze  dwi thvea  r
My bicycle's rear tire is flat.,this bi cyc rei sminemotton s
I'll lose everything.,idlllu in usa rr irr roseef er
Sami respects Layla.,kth atfro mlayla
This is what Tom said he wanted.,d om zaid thad s whathezarways wamted
"New York City’s government announced last month that it is providing $500,000 to create two urban farms.", newyo rkcidy newyolgcity’sgov ernmemt anmoun ced lastnomthdha ditisb r ofi ding50  0 0  00tocre ade twoulbamva lmz
She waved back.,sheslip ped s hew avetbac
Tom leaned over and kissed Mary.,toml ea ne dove randkiszet  nary
We heard that you were sick.,ifehea rddh atyo ulequ i
Mary looks like she's amused.,ma l ylookzexac t rydhesamea  zzheal waysd oes
It would make Tom sad.,w ourt maket o msad
Tom and Mary said that they were betrayed.,do m antn alysai dthatthe yfel  tnanipulated
"Kabyle, Algeria, is one of the best places where you can learn Berber.",li ai some ovd h ebes dpracesw heleyouca ml  ea rnpelber
I didn't expect to be so busy.,dohaf ef un idid m texp ect to
Yanni trusted a lot of people and that was the reason why he was taken advantage of.,ya nn itruzdet  aroto fpeop  reanddh adwaztheleazonw  hyhew a stak  ena  tvandageof
The restaurant was far from the station., tauran d wasvarfr omdhesdadion  z
Please pull down the blinds.,preas e p utthe trashi mthet razh
We've both seen it.,iz awt he file wefe bo thseem 
Maybe I'll never see you again.,m ayp eirlmefelz eeyoua  kain
"He's really excited, isn't he?",h ehasbeenp usy hasm  the
She took a protein shake.,het ookab lote imzha ge
Tom slept a lot longer than me.,idho uk hdthatdom waznt as leeb t onsleb t arotl omgerd h a
Tom remains in jail.,donre naimsi mja i r
Does that name ring a bell?,t oe sthat  name ringabe ll
Take a helicopter.,i mvlyi nginan
He raised his kids in Kabylie., isethis kidsimkap ylie   id ook nyfanily t okapyl ie
It's your fault.,t hatisa mis dake its yo urfa
Are you absolutely certain about this?,doyou b eri  evethatwilrbe d hec ase
You're gonna be a grandad.,you re konnabeagr and ad
Snow prevented the aeroplane from taking off.,pr ev entet theaeropla n efrontakinkoff  b ecauseov thesno wi t
I guess you know what to do.,ikno wn o wwha twehav  ed odo
You don't have to go to the trouble of getting an umbrella.,y outo nd hafedogod odhedrou  ble ofke  ttimga numbrelra 
Tom and Mary picked their mail up.,tomk odmarysne ssa ge
He is neither a stock nor a stone.,he sm o tanusl imyet
Our job is to protect our children.,ourjobist opl otecto urc hil  dren
We respect Tom a lot.,iu zetd oresbe cdto m
But Bangladesh is very promising from the economic point of view.,bu tba mgl ad  esh isve ryplomisingf romdhee conomic poindoffiew
The uncle is cooking a mass of chapatis.,myuncrewi rl beco og imgno palz theunc le isco okinga mazs ofc ha badi
"My favorite bar is located below the railway, so I always hear the clanging noise of the trains passing by when I'm drinking.",i vemefer tr aveledbytla im myfafoli de ba lis  lo cated  bel owd herailway zoiarwayz hearthec r  an ki n gn oiseo fthe
Tom said that he didn't want to sit with Mary.,tonsa i dthat 
I wake up in the morning at seven.,geubi nd hemo rn ing adse vem  iw o keu batten
Tom and Mary said that they weren't intoxicated.,t oma mdmarys aiddhatthe yw erendintoxi ca tet
The time loop reset.,t hetime loo p
I can't deny that.,i can  ddenythad
Yanni is quitting tomorrow.,yan niwazleafi mg work
The centipede woved through the fallen branches.,thec en tipe t ewovedthloukh thefall enblan ches
We need to discuss this further.,movurdherdi scuszion iznec es sary
Mary made waffles.,marymade som
The villain appears.,he z awak hosd t h efillainappear
Tom may be ticklish.,donnaybeu npi a zed
When are you driving to Tom's?,omiscon in k whe nareyoudriv ing 
You were probably wrong.,youwerepropablyw r on g
That kind of machine is yet to be invented.,thadkim 
I gave my old clothes for the flea market sale.,i kav emyold clothesvor thev r eam arg et sale  iz o
I don't have any more records.,iton
Don't drink this water.,thizw at eris no tcolt
"""Rima missed Ziri's meat."" ""What do you mean?"" ""Forget it.""",s iriaz ge trimat ofolketabo ut walid
I knew that Tom wasn't yet finished doing that.,i gmo w thadto md idndgn  owdhathe wa ssupbose ddod  othat
I didn't know that you worked for a security company.,dm tknow thad youwor ge  tfolaseculi tyc ombamy  ig nowth aty ourecent lyg ota job
Tom is having a hard time swallowing.,  nkaha  lddimesw alrowimg  tomloo ksr ikehe za
You have to stay away from her.,ostop her youh aved ost a yawayfro  mhel
Tom must've been a great teacher.,domisasg ill fu rdeacher ism  the
People are appreciative.,beopl
I don't want any milk at all., tw  antanymilk ata rl  idon twa nt do
I swept the yard.,i anlimpin ga long
"""Where Reindeer Roam"" is an original Esperanto collection of short stories about life in Lapland.",byreatingimtereztimgzto rie s youllsoomnoti  ce thadyo  ual lea tygmo w howtore ad w elrime sperando
Tom didn't mean to offend you.,tondo esntwa nty ou
A bee sting is a painful thing.,abr edtedmet lari swli nkly
They say psychology isn't an exact science.,imnotaso cio ba dh the ysayp syc horokyis ndanex ac dzcienc
I am going to use the highlighter to highlight the main points.,i  naboutt on a keav er yimportantphone call
"""How's your couscous?"" ""It's delicious.""",id zableas uretom eetyour ik ew ise
Weren't they satisfied?,werentthe ysatisf  ie d
Do you want me to help you get up there?,do you wamt me to help you ge tup dhere
Racism can be revealed through people’s actions as well as their attitudes.,camc amca nc an camcamcamcancam cam laciz n canp elevealeddhlo uk hpe obre’zac tionza swel 
Tom has no idea when Mary plans on doing that.,ikmowdhad domdo es mtkno  wmaly w an ds dodot hat
Tom said that he hoped Mary wouldn't do that again., aidtha dhehob et malywour dnttot  h  atagaim  ton said m aly doezm dwantto
Tom doesn't seem wealthy.,dondo esnt seemwe aldh  y
Are you finished washing your hands?,a reyouvi m ishedwash ing yourhandz
"""But I, who walk the Queen of Heaven confessed, / Jove's sister-spouse, shall I forevermore / with one poor tribe keep warring without rest? / Who then henceforth shall Juno's power adore? / Who then her fanes frequent, her deity implore?""", l ifore verm olew ithomepoold ri pek eepwalr imgwi  dhoutrezd  whot henhenceforthzh  arlj unospow elatore  w hothemherfamezf leque n thert eityimblol e  i mee tt oha vesom eth ingb
I've changed my mind again.,irlgedchan ged 
Tom isn't really good with children.,ton isg ood withkits 
Do you know when Tom came to Australia?,d oyo ukm owwh  entomcametoausd ral ia
Tom said that he's glad Mary did that.,dthat 
Ziri cannot rely on others.,zir i c amnotrely onoth ers
"I asked him about what he witnessed, but he wasn't very forthcoming.",iask edhimap oudw  hathewitm es sed budhe wasm tv ely  vort hcoming
Tom said that he remembered being there.,had h edlo o gatit tons aiddhathel e nem ber edb eimkt
"Come on, already!",kee pout comeomal 
Are you afraid of getting hurt?,ar e you afraid ovgetdinkhul 
With a shortage of midwives added to that of obstetricians it has become clear all over again that our country's obstetric care is in an extremely grave situation.,withaz hortake ovm id wife sad dedtothato f o pstetlicianzidhas bec onecle a ra ll oferagaindh a tourc  oundr
Let me write it down so I don't forget.,w hywi llivolg ett  owri teton yfami ry
I would like you to behave yourself at table., udopeha v eyourzelva d t able  illz etth etab le
The buds began to open.,dh ebud
Tom bought a new swivel chair to go with his new computer desk.,tom boug  ht ane wsw ifelch airdok owidhhism ewc omb ut eldesk
Tom is suffering from a mental disorder that impairs his judgment.,to mi zs uffe ling fro nanenta  rdizorte rdhatin pairsh
Tom was always encouraging.,lwaysen coulagimg  to mi sarw aysnelvous
Tom can't teach French either.,ih atnoit eath
I think you know the answer to that question.,dhinky ougmo wt heanswer todhad q  uesti on  ign owy oumusdhavea nillionq u
Tom tried to literally break the ice.,dtobre a gu bt hefi kht tomd ri edtolid er allypleak
I know Tom has been forgiven.,ik now to mhaz beenforkiv en
Sami walked outside.,sa miwalked   oudside
Dania did this to show Fadil that she loved him.,fa dilw az ntu b set wi th daniafolwhatzhedid
Tom took the ski lift up the mountain.,d omdeci dedd osgi rathelthans nowb oald
"Tom decided to ski, rather than snowboard.",untain d om d ecidettosgilatherdh ansmo  wboa
"In the sunny afternoon, today the 21st of August of 2022, my family sipped some King Arthur's Dry Mead from Chinook Arch Meadery. For many years, I've wondered what mead or honey wine would taste like, as I know that our surname in would-be Esperanto means ""mead frog""—""medo"" plus ""rano""—""Medrano."" It's like a drunken amphibian. Ancient Egyptians consumed mead, and ancient Beowulf and Tolkien writings mention it.",i leme mpelazac hird i nthe1 970zinthe philibpimesd herewerem a myco nicsindak a lok ofdiffelent gen rez tha tphen one noncomtimu esto day ienj o y par d ic ulallydhewhollytla m s late tfantasypo og the e xplore rsbykilzde nmi mweyinto daga logwi dhna chinetlansl adiongre a try inprovingnaybe therew illbeman yw holeb oogsdrams rat edbymachi newidhma ypezonehunane diti n gamtdingerinki mt heconinkd e cade snachin et ranzl
He needs discipline.,hem eeds his privacy
Everyone has a signed contract.,ever yonehaza zignetcontr  act
Tom isn't someone you can replace., n tsomeom eyouc amle place  do mizm doneo ft hem
Release the dog.,tak ec are o fmydo k vorme
"She's very sick, isn't she?",hezve ryz icki s ndshe  zhesupsetiz
A quick temper is the only defect in her character.,aquic ktemper isth eo nlydef e cdinhe rc harac ter
Tom said that Mary doesn't have to eat anything she doesn't like.,sn dver yh umkry t oms aidt hatmar ydoe smdhavetoea da myd h imgz 
You'll only understand the story if I tell you what happened to your father twenty-five years ago.,y oullom lyun derztamdthezto  ryifite llyouw hadhappen ett o yourva dhe r twemty f i feyearsago  
"Muslims believe in Muhammad, peace be upon him.",muzlim sber ieve i nmuhannad pea cepeu
Ziri will never eat fish again.,z i 
Ziri heard yelling in the hallway.,zirii sdalki ngin ast ramgev oic e
I can only discuss it with them.,icam o nrydi scussidw  id  hthen
Yanni passed by the creepy forest.,y anni slidacl oss theload
I'll never leave Tom., erleav etom  tomnefe lbea t zme
Tom usually doesn't win.,ibet to  nwondwi n
Tom doesn't have any siblings.,n does mthafe anyfamiryh ele dom doesnt haveanyzi bli 
Tom wanted to be a better husband.,l edswisht omal rt hepe st
"""I certainly hope so."" replied Tom.", rtai mryhopeso re pliedtom  tom
"For once, Tom simply had nothing to say.",nc e t om simbr yhadnothingdosa y  ih ave no dhim
We come from Britain.,w ec om efr onbridain
We're hoping that things will change soon.,thingswon dliger ycha mg eanytines oon
We queued for hours.,etanhour wequeuedfo rh our s
Tom and Mary did everything they were supposed to do.,t on amdm  arydids   omethimginev erdhoukhdtheydd o
"He's quite strong, isn't he?",he squ ides tronkis mdhe
"Tom has been in Boston, hasn't he?",tomhas be enin bo zt   onhasn the
Ziri listened to Rima's explanation.,ziliris d eneddolimas exbramadi on
Oh well.,ohw e  rl
This coat will keep you warm.,coatwirrgee pyo uwarm   t hiscl othfe er srikeverfed
It's not what I meant to say.,it s  m otwhatime  anddo say
Neither Tom nor Mary has homework to do.,ne i d helt on nolnaly has h onewolktoto
Tom has cooties.,domisplazt el ed tomhasco ot
Tom still doesn't know what to do.,omdoesn tkm ow howdot odh at yet
Dan did it with care but with ease.,fadil wa sntup sedw ithdani af orwhatzhe  dit
"There is a saying in our language: ""It takes a thief to catch a thief.""",thelei sasa ying imoullam gua keit   t ake sa th ie vtocatc hadhiev  thisis dhefableovth
Tom was bothering Mary.,mal yberatetdom 
You speak too much.,yo u leagoot speaker
"Some movies make such an impact that one never forgets them. Such is the case with ""Life is Beautiful,"" the emotional Benigni film that mixes drama and comedy in an exceptional manner.",sone moviesma kesuc hanimpa  ctthadomemever   f orgetz th emsuc h ist hecasewi thrive is beau tifulth eenot  i o  na lpemiknifirnd had mix  e sdlamaamtcomed yinamexcebtiomalmanner
Our football team beats all the others in town.,z o ccels breada llovert heworld ou rvoo tbarrte anbea dz arltheo 
"She isn't very talented, is she?",zhe saver ygoo d painde lism tzhe
"This is called hatsumode, the first visit to a shrine.", uno dethe f ilz tvizid toashrine  i sdhizy o
Tom's dream is to become an astronaut.,do mstre a m iztob e comeanasdlomaut
Let's not make any hasty decisions.,dha tdeciz io mhasntyed b eenmade
I offered Rima the job.,l im awazlivit io ffer edrin ath
Tom and Mary told us they could help.,t omand ma lytold ne they tlikedoh  erb
The following is an example.,a usdrariais amexen ble
Mary told me she liked pizza.,r y tor dmes heriketpizza 
"I read it on the internet, so it must be true.",mt  elme dzoit nusd  bedrue  dhest
I hope that Tom doesn't go to Australia with Mary.,iho pethatto  ndoe snd got oaus trariaw id hmaly
Does she still have baby teeth?,d o esshez tillhaveba bydee th
The street was blocked by a huge truck.,eztr e etwa sbloc kedby ahu kedruc k  i wasa rnos drunov
Tom hopes Mary knows that she has to do whatever John tells her to do.,to mho besn  aryk n owzd ha tsheh a sdo t owh ateverjo hmdellsheltodo
Igor's German Shepherd was running away.,igo rzger nan shepheldwazlunn im gaway
He wants me to fix this for her.,hes eag er  t otalgt oneapou dit
Sami was sentenced to six years for organized crime.,san iwaszentenced tos  ixye arsvo lorka n isedcrine
They were caught red-handed.,dheyha ntretsna kes dheywelec au ghtle
Sami and Layla ate dinner together.,sa mi an trayl aated innert ogethel
We could get fired for doing this.,wecoultg etfi re dfor doin k dhiz
Tom was killed by a land mine.,waski lre tbya lamd mi ne  to mtiet vlom hizimju ries
Tom wanted to be the last one to do that.,tomis g oi nkto  haveto s dobdoimkth at
She said she was going to have her own way.,s hesai dshewa sgo  ingdo haveh e   rowmwa y
He's obedient.,beti ent  he isalas c al
Mr Shrek of the swamplands lived happily in the backwoods until an adventure came knocking at his door.,mrshle ko ftheswamp randsriveth abp ir  yim dheba ckw oodzunt ilamadve  ntu re cam
The tomatoes have grown well.,mh azimproveda gr eattea l
Now I will do a demonstration of teaching subjects regarding the Kadazandusun language.,ervsdudyguide nowiwir rdoatem onstlat iomofteac hingsu bjectz legardi  nkt  he
Turn that up.,zw itch itom
Plug up that leak.,ma keat igh dvisd
He lived in Serbia.,hel ifesi mt hadstade lym ansiom
I have no recollection of how I got there.,l lect iom ofh  owi go tt hele  i can tre memberwheleib urie dthem
Clothes and fashion are not so important to me.,clothesa tarl cr oth e zamdfa sh i omar emotsoi mpordan
Tell me what you want. I'll get it for you.,t elr mew hat you wamdi rlk eti dvol you
I didn't know you'd come back.,w you t c oneback  youdidn te vemkn o wmethen
Love sees no faults.,s love see z nofaulds
He often sings with his friends.,sheov temspeagsa b out helf iancé
I'm glad to see your sense of humor returning., yoursenzeofh  um orleturning
It is strange that he should not tell me anything about it.,idi szdr am k e thath esho ur tmott ellmeany thimgabou tid
Tom likes dogs but he hates cats.,a t escads
"If you eat any more dried mango, you will certainly have a stomach ache later.",iv youe at any mor et rietmango yo uwi llcer taimlyhav  eazt omachachel ater  you sowed th ek rain
Yanni was from the wrong side of the tracks.,azflomt he w ronkz ideofthetr  ackz
Put all your force forward.,dr yitpya rln eans 
"We all searched high and low for the missing documents, but they were never found.",ealchedh ighamd r o wfoldhemi ssimg do cu ments   pudtheywe lene velfou nd  ilookedo
Fyodor left the next morning.,tomisle avingdom orl owmormin k
I didn't get back home until very late.,id idntge tpac khom  eun tilvelyla de
Maybe Tom won't do that.,that
She's got long hair.,shez 
"As he sat next to his dying mother in the nursing home, Tom regretted not having been a better son to her.",asheza tnexdt ohisd yin  gnodhe ri nthemulz ing  hon  edomrek l e dte  dmothavingbee m  abedterzontoher 
Your analysis of the situation is accurate.,oura maly sisov the si tuat ionisaccurate  thes it
"Sami was sitting on a bench and Layla was on his lap, making out with him.",provedhat shewasa llhiz s aniwa ss itd inkomabenchamdl ayl a waso m hisl  a p m aki nkoudw
There are a lot of people and cars in this city. It is a busy city., ale alotof beobl e   an dcar simt his c idyitisapusy city
Did you lose your contact lenses?,yourkrazs esareb rogen didyou lose you lcont
Thanks for making me remember.,iwa n dtot ha m kyoufoldha t
I didn't know that Tom would show you how to do that.,  mwoul   dzhowyou how tododha t  do mdoes n t
Who is the leader of the group?, oi zthereateroft he g roup  whosec omtaine risdhi
Mary said she didn't think Tom wanted to be on the basketball team.,narysa its hetid  nt thin ktomwam  tettobe omtheb  asgetballt ea
I plan to return.,ipr
Somebody crashed into me on my way home yesterday.,yhou se sonebod yc laz hedi mtomeonm ywayho mey 
Ziri found out who that phone belonged to.,ziri foumdo udw hoth atp homeb  elongeddo
Thomas lay down in the grass and closed his eyes.,tohisbackyart t hon asra yt owmimth ekla  z
It's very hot today.,idzve lyh ottod  ay
Yidir is selling wheat in the market.,lealcrops
Ziri will win this time.,z iliha s gottime ziri w irlw i mthist
I think you'd be surprised.,youshoultnt besurp liz et
Yanni and Rima's marriage is off the right track.,siri amdlin agottoketh  er
"Now that you've calmed down, let's go grab something to eat.", nowth ad youf ecal ned dowmre  tsgoglabs omedhin kt oead
She persists in her belief.,shebe lsisd sinher per  ief
Just do what I did.,j ustt owh atidi d
There will be a duck and various fixings; we'll be eating like kings.,d helew ill bea  ducgantv alio usfixi mgs  wellpeeatingl  ikekingz  illm
They can't get their cars to start.,heyc antg eddhei r carzto sd ald  youcan tg
John claimed that he was allergic to paper.,johnc raimet d hat hew as allergi c tobapel
Tom was in jail.,ktoj ail tomwasim j
Here's the bathtub.,p
Tom got down on one knee and proposed to his girlfriend.,tom has asketme  toma rryh in
The train for Birmingham leaves from platform 3.,dh edl  a i nfol pilminghanleafez flom platfolm3
Tom wants to tell you about Mary.,t elltomw h atmar ytol dyou
They say they'll wait for us.,t he ysaytheyr  lwai  dforuz
I know that Tom isn't on the team anymore.,id on tev engno  wwheled omism ow
Tom will probably be reincarnated as a squirrel.,e arive to nwirr propaplyberei nc arnatedasa  sq uirr
Are you acquainted with Visual Basic?,reyouacqua ind e dwidhf isual basic  to yo u kmowam yofdh osestu demts
He said that he wasn't sorry.,hesai the vel tlike ki v inkup
The first thing I saw was a dog.,the vils tth in g isawwas  ad  ok
My mother is French.,l a mce
I have a plan. Don't worry.,th atis n tw h atipran todo
I'm in no hurry to go home.,im i mm ohur ry togohom e  i
Can you speak more slowly?,s pea km or esrowly  courdy
Tom told Mary he wouldn't eat the stew if it had pork in it.,doesndh av et o eatanyt hi ngs hetoezntlike t omto ldm al yhewo uldnte  at dh  e ztewifit
Mary denied that Tom was the one who convinced her to do that.,kleed tod othad ma rydenie dth a ttomwas dhe onew h oco  mfimcedh
Are the Palestinians going to spend another one hundred years of suffering?,egilredpyisl ael al ed h eb ale stiniamzgo  inktospe ndan o thelomehumtl
The court judged the case.,t hecou rdjudged thec ase 
You will not deter me!,ouwilrnod de ter me
Tom doesn't yet know what he'll do.,do mt o esn tyedknoww ha t  helrto
I think that I can do this.,it hin gth atic a  ndothis  id
"""I don't know."" ""You don't know anything, do you?""",yo ud on dknowwh adsgoi m kondo
Can I have some hot chocolate?,can iget y ouac o ffee cami haves omehot choc
I don't want to go Boston with Mary.,omtwantd og obo ztonwi thn al y
No work is possible without an order.,ican dsav e any money mo wolkizp osziblewit ho u
Tom said Mary was likely to be awake.,to msai dm a rywasr ige l ytobeawage 
Generally the Americans are a kind people.,dhe american zarea gimtpeopr e  americanfi lmsa
There is frost on the grass this morning.,it kodco lde rda ybyda y t here izfro ston d hegra zs
My neighbors are French.,n ynoth elizvr ench
This is the current trend.,dhis 
Something you should know about me is that I'm very much a country boy at heart.,oudontal le adyknow zonethim gyo us hoult kmo wapout  m eisdhad i mver y nuchac ountlyboyathea  rt
Tom didn't need to buy that book.,cke dubhi sp ooks tomdi tnt needdop u yt h
You cannot miss it.,y oucanno tm i  szid
Tom and I were the only ones who knew about it.,i knowdona md o mlyton  cand  othat
Production has already begun.,ionhazarreatyb e gum
Sami never asks why.,s a m imeverasgsw hy
Carlos got eaten by an alien centipede.,car losgoteadenp yam alie nc emti pede
I thought that I could do that by myself.,erfit hink idhou ghttha ticour dtodh ad p ymy z elv
He liked drinking rose milk...,helig eddr inki   mglos emilk
The radio station broadcasts a very strong signal.,onbloadca sts averys d rongzigmal  th izm edlarisr eal lyhard
I only hope we can get this done on time.,iho pei trlha bpems oon ion lyho bew eca mge tdhi s to
Sami and Layla were servers.,samiandl ayla s eem ettopet eth eredto gedher
Jayjay moved in with us.,jo mashaznov e tim
My father cuts the wood with a saw.,myf a thel cuts the w ootwid h asaw
Do you think that Tom is still home?,hazal re adykone dobed doy ou dh ink thatt o 
I made that for them.,ina de
Mary got a nose job.,ma rybulreto uth elknitd imkneedre s
I didn't think that Tom was downstairs.,i di dntdh imkdhat tonwasd ownztai  r s
"""Then first Thymaetes cries aloud, to go / and through the gates the monstrous horse convey / and lodge it in the citadel. E'en so / his fraud or Troy's dark fates were working for our woe.""", etes criesaloud togoand  dhlo u ghdheka d esthenonzd loushorseco n v eyam drodkeidinthecita te r    ee n zohi svlau  do rtro  ysdark  vadeswerew o rkingforourwoe  hezeesh owv ikhtingroundthet roja nwalr h elevle
They take the same route.,wel eatdh e samecro ssroads
Leonid took the right decision.,l eo nwaspi szetapouti d
He stayed with you three months ago.,mth stozhootd hemofie h es taye dwith y outhleemont hs
Why can't you leave me alone?,whycan ty o u rea fe
It all started the day I was born.,ijust st al teddoday it all sta ldedt hed ayiwa  s
Is there water there?,iss hethe re
I'll be flying over the Pacific Ocean about this time tomorrow.,edhis avd ernoon i ll be flyimgovelthepacif icoce ama poutth is d ime domolrow
Tom has given several concerts in here.,tomh askif  ens efer ar conceltzinhele
"We camped in Kabylie, Algeria.",h ewaskidn appedinkab ylie arge ria
"You may well say so, but I cannot agree.",hyoupu tic ant younaywell za ys o bu tica   
Tom is pronouncing Berber words.,domhasapi e lcing f oice
Read the Quran in a language you understand.,dthequrami malank  u ag eyouund  erzdand  y oudeacharabic
"You were working yesterday afternoon, weren't you?", elew ork inky e sdeldayafdelmoo mwerentyou
Tom and Mary were both in Boston all last summer.,idom t thi  ngdonandm ar yarepacg from p o zdonyed
Mary could get fired if she didn't do that.,u lt ge dv ireti fshedi dnt t othad  m aly hasbe emto ldshecan dd od hat
They're walking without shoes.,dhey lewarg ingwi  tho utshoes
Whose container is this?,whop u tdhi spaberhe re
I thought that you might want it.,ithoughd that youm ik  htw an  tit
Give me that jar.,kive idb ac k tome
Yanni threw on a robe and went to the bathroom.,yan ni thr ew onalo b eamdwentto the  badhroom
Sami will be doing a group Skype meeting.,s ami iz makimgayoudup ef ideo
"Look, an agave!",wat chth evolest
I wish I were that quick.,iwiz hi weretha  dqui   ck
A set of benefits was once in effect.,a s ed ovb enefitzw a sonce inevve ct
Tom lost his house key.,t onnev errevtthehou se t omro sth izhouz
Is Tom going to live?,o mk oi nkdo rive
The fact is I didn't go to school today.,i tidn t gotoz choolto da y  iwon tplacdicet o
I miss my hometown.,i leallydomiz sbo st on
Tom's parents have decided to punish Tom for staying out all night.,tom sparent s haf ed ecid etdopu nizhton  folstayingo u dall might
I don't usually use bleach when I wash clothes.,usua l ryuse breach when iwashclothes  io mr ywea lwhitein the zumner
She devoted herself to him.,she de fodedherself  tohi  n
He looked me in the eye.,loo ketnei nt h eeye  isa whi mgo ims ide
"""Some people think you're a freak."" ""Who knows? Maybe I am.""",z onepeoplet  hinkyo urea vreak w hokn  owsnaybei am  th ev ils tandm ostcom n onbh
Sami was driving me home.,zamidoo km  edowndhe ha lr
Tom entered the cave.,eca ve
I vehemently disagree with his views.,zy mpa thizedwidh helviewz ivehement lydis agree  wit
Why are you sad?,dha ts zosat
Tom is three weeks behind schedule.,to m iso nlythle ewe egsolt
