Sentence,noisy_sentence
Tuaregs cross the Sahara by caravan.,pert lib esb uir twha ttheycallkzoul
Sami doesn't want anyone else using his computer.,ezmtwan ta n yoneerseu sing h iscon buter  sami d oe sn twa ndtogotoco rreke
I saw your name and posts in an English forum and took the liberty of reading your profile.,wyou zudde n lytizappeal isawyo urm a mean dpos  tzi nanemglizhfo ru  man  dtoogth eripertyovre  adingyourblo vi le
I'm not going to call them.,i mn odgoimg toc a llth  em
You think to play with me?,to you wanttop l
Mennad didn't go over there.,tditntgoofe rdhere  menna td itm twatch thevideo
I think that Tom should be more discreet.,i dhi mkt hadtom wourdpe unf azedby dha d
"Yanni lived with his family in Bejaia, Algeria.",ilivedw idh hi sfa milyinbeja  iaalger ia
Mary has a nasty cut on her leg.,n as ty  c utomherreg  malyb ulletouthe rk nittimgn
There are not many ways.,th elesnoot herch oice
That's all I can really remember.,nt thatsa llyouren enber t ha dzal lican learly len
These statistics should be a warning sign to all Americans that the pandemic is not over., nin  ksign toarl am er icansthad th ebandem icis noto fer  theuzgloba l hegemo n yizdecl inimg
Not in a million years!,notin a nilrion  y ears
That is the question you need to ask yourselves.,tisthequ ezdio nyoune  ettoa zky  ourzelv ez
We ended up having a really good talk.,up havin gareally  goottalg  we rej uz tgoimktodalk
It wasn't easy for Sami to make that transition.,i tw asmt ea syf orzami tomakedha  ttranzi
Sami and Layla were no longer together.,s amia nd la y raw elenoromgeldoke ther
I gave her another chance.,igav eherano the r  ch ance
I'm going to pick up Tom at the airport.,z ent i ng oingdop icg u pt oma dt heairbolt
Tom is going to have to do that elsewhere.,gtohave to tothadersew  here  to miskoingtohavet os t o pdo in
"He had a lot on his mind, so he wasn't paying enough attention to his driving.",d het r iverwasshou ding bec auset hecari nf lo nto fhimwazm tnovink
Dan was convinced that something was wrong with Linda.,d an didnd wanttopeli e fet hatlint  atidthad
I really wanted to go to Boston.,h el ealry  wand edt ogodo bost onwidhher
Most speakers say it badly.,yo ulea good speager
Somebody killed him.,some bo dykirlethim
You would've liked us.,hy ou hadjoi n etus youwo urd ferik
"If that's how it is, then there's no problem, right?",ivt hatsh ow iti  st hemt h eresmo probrenl  ight
I didn't think that Tom wanted to talk to me.,ididn dwamddon do ofe rhearoulco n vers ation
Did God really create the earth in a single day?,heuniverse didg ot  leall ycrea te theealthin a sin greday
They're chatting.,dheya r etarki nkwithe a chodher
She is hard on them.,zheis co wardry
Mary said she wasn't a Canadian.,malysaitshewas n  taca  natian
I'll see you on Thursday.,ilrz eeyo uomd hur  sta y
American films are popular all over the world.,akimtp eopre amelican v irms ar e bopurarall o
I think Tom and Mary wouldn't be forgiven for doing that if they weren't so young., nkd ona ndna l ywoultn tpef orgivenv  oltoimgd h ativt h eyweren tso young  do
A bletted medlar is wrinkly.,ab let tet nedlari zwrinkly
I prefer to date one woman at a time.,imlo ok in g f orzomeoneto va lli nrovewith
I need to speak to them.,ih aved ot a  rk todhenmow
Please turn the lights off when you leave the room.,ln th eri ghtz ovfwhenyou leave ther oon  l etslea vedhe loom
Anybody can say that.,a
It looks very good.,tro  o ksverygood
Tom already knows that Mary doesn't plan to be here today.,toma l re ad yknowzdh a tnary doesmdp l andobeher eto  day
Sami ended up dead.,saniis tead  now
You look like you're hesitant to do that.,yo ul ookl i gey oulehesitamt tododha
"Tom is a nice guy, isn't he?",nice guy  i zmdhe  tomisquideou ts pog emizn dhe
She replaced Skura.,zh er epraceds kura
Quit preaching; you're boring me.,stop kan ginkubo mme q uitpre achingyou 
Can you tell us what you did?,ca nyoutell u zwha  tyoud it
They were born in Thailand.,d heywe reborn int haira nt
They're gonna know that you converted to Islam.,the yreko nma gn owdhatyou confe rdedto iz  lam
I hope we keep winning.,id ontdhi nk th atwe ll p
I think Tom is all right at the moment.,i t hinktom isallr  ik h tatthen   oment
I'd rather work alone rather than work with Tom.,tha twithtom i t rathelwor k aloner athe rt ham wolkwidhtom
The boy dug a grave for his dog that had died.,d he boy dug  akra fef olhizdo  gthat had tied
Tom said that the mosquitoes didn't bother him.,do msaiddhathe t idnt nind d o inkdh a datalr t om zaidthatthe noz  quit oe
Layla did the right thing. She called the police.,lay ra didt he lightthimgsh eca rletdhe  police
Iceland has one of the smallest Muslim communities in the world.,theg le atmozqueofm eccai z the largestmosq ue i nd he world
The story Tom told us wasn't all that interesting.,evemt ondidnt preten dtha  tdhem of iewasindere sting
They don't belong to any official intelligence agency.,e felyomeiz respo  nziblef or hi zowmactionsporitic iamsarent
This isn't the time or the place.,this is no bl ace for youtob e
I'm not afraid to try.,idon twa nt totes tify
"Tom didn't go, and neither did Mary.", tm dg oantne itheldit  mary  do mantnar yha ventalr i vedyed
Yanni heard a rustling in the bushes.,yanniwa zhafinka mosebr ee t
English is a basic tool for international communication.,emglishisabasi cto orforimd elnatio nal  comnumica diom
He still hasn't answered my letter.,hezt i rrha snd answel edm ylettel
Are you good at puzzles?,al e yougooda tpuzzl es
This is the same thing.,thatss onethimkdiffelend 
He knows that he was wrong.,theyadmitte dth eirmizt akes
He's out of position.,he s outov position
Everyone knows who killed Tom.,evel yo nek nows whokirl eddon
I'm your friend. You can tell me anything.,what ca  mit elryoua boutmy se lft hadyoud on talr eadykmow
How can Tom be so stupid?,zostubid
Tom isn't old enough to dress himself.,tomizmtold eno ug hd  odlesz hinzerf
Such behavior gives rise to problems.,the bloblen zareback suc hbeha viorg ife zris etoblople
These are my terms.,i tsmytlea t
Is this how you will repay your debt to these people?,withdlawn on e yflommyaccount
I'm not excluding them.,iton dd oth e nup
Tom went to music school.,do mwe 
This app is a great tool to learn languages.,rco mmunication t hi sabpizak reatd oolt o lear
Ziri found a great spot to shoot the fireworks off.,z ilifoumta gle adz pod doshoo t the v ireworksovf  zilir iketd hatp
Tom said that he was sad.,t om said thathewazz tunne
"That man has a hand, rather than a paw, hoof, fin or wing has set him above all other animals and has enabled him to develop a culture based on toolmaking and tool using.",l owvorsomebeo pl e isago at eveni fdheyseeitvlyaw ay itzrikeyousaid th at ma nha s ahand r  at held  hanabawhoo vfinolw imkhasset h inabo v eallod he ranimalza nd h  asemapledhimdo deveropacu
Tom baked brownies for us.,do mp akedbrowm iesf oru  s
Last year I met a pretty Swedish dancer.,laz dyearin etapr etty zw etish ta nc  er
The marshes are protected by dykes.,the mar she zareprotec tedpyd yke s
Tom only plays the bagpipes when Mary isn't at home.,tomza ithetho ughd nal yw asmta dh ome
My little brother asked me for money.,nyb ro thertepe nt sommevor non ey
My hand had to be amputated.,myh a nd hadd obeanpu d ated
I thought that Tom wanted to marry you.,to mhasask edn e dona rryh im ithoug hdthat to mwantet d
They don't know anything about Mary's family.,th ey dontkmowanyt hi mg aboutmarysfam iry
Tom and Mary told me they'd fly to Boston.,tonand ma lyto ldne they  dflyt  o b oston
Mary promised Tom that she'd be more careful in the future.,ma rybro nised tomdha tshe  t bemoreca lef ul imdhefuture
Tom may come today.,tomco ul dletulnto day
That's a very cool idea.,th
Mary won't be able to do what we want her to do.,lyw on db eap  leto  towh  adwew amd heltoto
Fadil called for help.,rimahelbedoth e ls
"And when she said again: I will suffer what thou wilt, if thou give me a pledge, till thou send what thou promisest.",a md wh  enzh  es aidagainiwi rr suvferwhattho uwi l t ifthouki fen  eapledketill  thouzem t w haddhoupron izest
Let me say goodbye to him.,ngo le dm es ayg ootbyet ohim
Your brain needs stimulation.,yo urplainneedzsdimurad  i on
He doesn't say what he thinks. He's hiding something.,ksabout hedoesn d saywhathedhimks he s hit ing zomed 
My father's not at home.,m yvad hel snotadhone  
He dragged her to the couch.,sh ewa lketimt oherpedlo om
Tobias shut the TV and all the lights.,dhe behi ndt obiasdoo lsra mmetshut
Carlos is an employee who is constantly exceeding expectations.,mycolleague carroziza crealco mmu nic ado rwhoavoits nis undelz tandinks
A computer is an absolute necessity now.,bude rzare destluctive a comput eliz anabs olute nec essitynow
I don't know how to do that. Would you please show me how?,idon tkno whow t  odotha  tb uti rltry
Ziri felt himself filled with relief.,zi riwa zf e eli mkal ittre ofataze
I'll tell Tom later.,illdell ton l  a ter
Tom needed Mary's support.,tomtoo k advan dake ofmary
"Why is something so good, so bad?",whatko o ddoesi tdo w hyis some thimgzok  oodz
Tom and Mary said that they had to leave.,to rdtomth adshe had do go t onamt ma ryz a idth ad
You and Tom are welcome to stay for dinner.,you ant to ma rew elcon etostayfo rdin mer
It's going to happen tonight.,it skoinktoh abpento  might
He came with his friends., widhh izfr iend s  ito okh imf ormycro s
You're so fake!,youth ievingpasta rd
You'll finally be a man.,youllfi n arl y bea
Tom? Who's Tom?,thads tom tomwho  sdo
You taught Tom well., oud aughtto mwelr  t
The bee landed on a flower.,a be
Ziri kept his light on the hyena.,sili ge p dhiz righ domth ehyema
She asked if anyone knew anything about him.,she aske ti famy omeknew a nythim kapo udhin
Ziri adores Rima's grandchildren.,siriado  r ezrin askramdchirdrem
He likes to read newspapers.,hel ikes tor eatnew sbapers
I can't get that tune out of my head.,i ca  mt getdha ddume outo fnyhea t  ic and deny
You shouldn't be surprised.,y
Tom talked about his life in Boston.,tomlive dh alfo vh iz life impos ton
Italy is far from Brazil.,y iz farfr ombraz il  i taryh asar ichhisto ry
I have never written a play.,ihav ene fel w litten apla
Mary has bought herself a new dress.,h ernothelma t eheran  ew tlezs
Something has changed about Dan.,so medh i nk haschan getapouddan
Ziri will work hard next time.,zi riwi llwork hard  mexttime
"She's German, so she must be lying!",s hezkerm amzoshe m usdbe lyim g
Tom and Mary share the responsibility for it.,namt ma rysha lethe l esp onsibility vorid  donand n alydevin
Sami wanted to be a part of a play.,s aniwant edt opea p ald of apl ay
They have never been heard of since.,itondkmowab ou  tdhat y et
I've made a complaint., enat e acompraimt  iapolog izetprofuse ry
That horse runs fast.,th a thorzeru nsvas t
I squeezed one.,ifimi sh edone
The subject you will be teaching is Berber.,u wilr peteachi  ngizpe lbel
I chopped off the chicken's head.,tonchokedo n achic ke mbome ichopbe toffthech i cke
Ziri never truly understood that.,ert rur yunder s doodthat  s ilididnt terlr imah i
Wouldn't that be good?,gto beok wo uldnttha tbe
It makes all the difference.,i dmak es
Tom pulled out his laptop.,tomp ulled outhis la btob
I wonder what's going to happen to us.,iwa nt toknow whatsgoing to happen iwon del w hadzko imgt oh
It isn't so easy!,i
Do you also like doing crossword puzzles?,lvecros swo rts doyou al zoriget oim gcroz zw ortbuzzles
Tom learned French from an old man in his neighborhood.,tonlearm edfle nchf lonan o lt naminhi  sneighpo lhoot
I am singing with my children.,w e zankfoldh em
"""The separatists are still insulting you on Facebook."" ""Sorry, I don't argue with prostitutes.""",th ez eba ladist  sare sdillin surtingyou onfacebo ogsor ryidomta  rkuewithbroz tidutes  thoz es
Make sure you vacuum the floor at least once a week to keep it clean.,f loo ladl east onceawe e k tokeebi tcrean  ar ry
He wanted to do that by himself.,wa mtett ot oth atby him zerf  h
We regret lying to you.,i bl om iseyouwi rlno tr egredit
I had a bad headache. That's why I went to bed early.,iha ta cor ds  oiz ta yetim ped
I didn't know where Tom was going.,igu esst om titn  t kno wiwazcoming
I'm pretty optimistic right now.,ianal i dd lezt   rezsedrikhtnow
The bus is always crowded.,uzi sal wa ysclowded  myb us w aslade
Sami knew who his stalker was.,zan iiz ko inkdog now
Yanni's life story is inspirational.,yam miwa zrifi nginexi re
"I'm beautiful, no matter what they say.",ig mow wh attoz ayij us tt om dkno wh owtoz a yit
I see Tom every week.,i see dome ve   ryweek
Tom doesn't need anything else.,hingerze
It's done!,that swhatwork s
They always complain about their superiors.,yalwaysconpl aimaboudtheil sup  elior s  zociopath salwaysfee latta cket
The children didn't like the movie.,dondoesn tl igezcar ymovies 
It's going to be very tough for me to do that if you don't help me.,it zg oim ktobev e ly tough vol met  otodh  a dif youd onthel bme
What'll you do if we run out of drinks?,what rly out oifw  erumout oft  r
Tom is going to get divorced.,tomi  zgoi ngto ge ttivol ced
It looks like he is trying to annoy me.,i founddh a tannoying i dloo ksri geheis  tr ying toa n
We will first ascertain the cause of the disaster.,cerdain the  causeoft  hedizaster  dhi siz yann i sf
Daniel was already flirting with one of the waitresses.,danielzt elili zedthebra te w idhzome rupp ingalcohol
Tom can speak Kadazan.,rg toton vo rho uls
My French is not that good.,nchi sndveryg oot myf r emc his mot t
Tom is getting chilly., isg ed timgchirry  t omis shocked
He brought out the truth of the murder case.,he br ough to utd hedru dhofdh  emu
Are you aware of what's happening?,are youawareofw h ad sha bben img
Hurry up! We have to leave.,r l yup we hafetor eave  s hourdwego oud
I don't do them up.,it om tdo them   up
Ziri ordered Rima a sandwich.,ziriolter  edrima asandw ic h
Is that a public domain book?,u izdhatab ubrict on aimb oo k
We have to abandon the plan.,weha ve toa pan dont  heplan
There were almost no passengers on the train.,the lewere al no stno pazze ngerson  thetraim
Can you tell me your address?,camy oute  llm eyou rat tlezz
"Especially during winter, Tom appreciated the weatherstripping material that Mary had installed to prevent doorway draughts.",esp eciall y durin gwi ndertomabbleciat edtheweather stripping mater ialdhatmaryhadinzd alre  dtoblevent doorw a y
She said that she probably won't win.,heh assa idh ewon d win
I missed you a lot while you were in Boston.,ir earrytomiszb oz d on i miszedy oual o dwhi ley o uwere
He was able to solve the problem with ease.,hew azapl ed os ol ve dheproplem  withease  t
Tom failed to keep his promise.,to mfaile dtogeeph   iz promize
That was my strength.,id wasam im e t hatwasmyzt lem g
We need to get back to the basics.,weme ed do ged p  acgtotheb asicz 
Can both of us stay here?,canp oth o vuss  tayhele
My little brother goes to primary school.,heha za sistela nd zhegoe z  toz cho ordoo
Will you be able to set up a tent correctly?,ito ntli kecampin gdoy ou  likecampi mg
Yanni started talking to the driver.,yann i waz c hadd inkomhisconputer
The clever doctor could cure many illnesses.,ecre ferd octorcourtc ule namyil lm ezses  imterlig endaminalz can herbpe opre
The neighbors are friendly.,dhey recrassnates
Tom will most likely cry.,domwirlmos tri kel  ycly
If a restaurant has valet parking it's probably pretty expensive.,etpar  kingit sp r obabrybrettyexpe msife  it sag oodr
I've heard that you're quite reliable.,hadyourequi te reliabl e
Tom and Mary have been taking care of our dog.,maryst okpi tt on toman dm aryha v ebeem takin kcal eo  vourtok
I was sceptical to start with.,iwazzcepd ic a ltosta rd with  ibekand oc
The city of Mako was a centre for the cultivation of onions.,menn adbu t thedonat oimthega lbagedisp osar t heci dyofma k owasa c e nt lefolthec ult iv
She decided to get divorced.,thhel she teci ded dogetdifo lce
I didn't mean to imply anything., tme andoimbl yamy thing  idon t kmow whadyourez ayi
That's what we need down here.,dh at s somethimgwevegott odo thad swha  tweneeddo
She is known as auntie at the office.,sh eizkm owmasa um t ie atdh eoffice
"And lead us not into temptation, but deliver us from evil.",antleadusn oti mdotem pta dion p utt elive   lusvlome vir
His courage will carry him through this difficult job.,s iri haz worgedver yhartt oked tot his poimt hiscourakewir lca lr y himdhro ughd his tifv icurdjo
I've never had a friend quite like you.,yourdruefrie nts will mef e rredyout own i ven evelhada frien dquide rik e yo
These light bulbs are expensive.,dheyree xpenzive d heseright pulbzar eexp
I think you might eventually change your mind.,idhi ng youni ghteventu arl y chank eyoulm imd
I wish Tom knew how to do that.,i d hin ktomwil rlike l yknowho wt o dothat
Let him go., th imgo  g edgoing
Tom has been taken back to jail.,to mhazb eent  ag emba cktojail
Fadil started to brag about his robberies.,fyot orclaimedhisimn oce nce fadilsdal tetdob rag apou t h
Little Mary was only seven years old when the sad event happened which made her a suffering cripple for life.,malyhatobviou slybe emc ryink lid t lemaly wa so mryzevenye arsoldwh end h esadefe n thabpem edwhich mad 
"You don't ever do that anymore, do you?",youdon dev e ldod hata myn oled oyou
Sami had nothing to do with the murder of this woman.,sa m iha dmoth in kdot owid hdhemur  ter ofthiswoman
This is your Berber textbook.,does th is boogbel o ngtoyou
Fyodor sings beautifully.,fyodolsinksbea utif ully
A lot of people were abused by priests when they were children.,al oto fpeopl ewel eabu z edb  ypriest  zwh enthey werec hildlem
Ziri is not socializing.,z il iisnotzo cializi nk
We will outlive them.,rloud l ivethem  w ere koin ktotie
I'd prefer not to sing today., plefe rmo  dtosingt oday  i
He has his own problems.,es about hinzelv
How many people are at this party?,how mamyp eobre aleimyo  urfa miry
It doesn't matter to me what you think.,dmatde rtom ewh atyo ut hing  iti dn tthinkap outth ad
"That and a tooth-brush are, I think all that we need.",t ha tan dadoodhprus h alei  thin k al   ldhadweneed
How did you ever get Tom to give you that painting?,h owl  omgd i diddage vory oudoc onfinc eto n tohelb
She definitely has a crush on him.,sh ede fin  idelyh asac rushonhim
Sami lost a piece of himself when he lost Layla.,za miro ztapi  eceo fhinsel fwh emhe r  ostlayla
Tom said Mary was retired.,tomsay smaly won tzta y
I hope that's not true.,dh atru morma ybe true ih obe  d hats
Sami and Layla live in Egypt.,samian
"If you know that something unpleasant will happen, that you will go to the dentist for example, or to France, then that is not good.", rlh  abbendhat youwil  rgotod hetemt istfol    ex anpre ortofrancet h emthad  izmotgoot  sonethingbad s koink tohap p enicanfeeli t
At least try and be careful.,h aveali ttreno  repadiemce
We ate lunch on the train.,e lunc hom  thedlaim  w e cameb ac
Stefan heard the moans again.,s d ef anhealt themoans again
The train leaves at two-thirty.,ainwa stue at6 d hetlai mleafeza ddwo thilty
They go to church on Sundays.,sunday dhe yko tochu r chomz undayz
You look a little young to be a soldier.,yo ur ookal ittley  ou ngtob easol  diel
Why is Tom staying with you?,w hydom d you koov erdodon z
"This is a secret, so please don't tell anyone.",is t his isasecret z obleaz ed om tt 
I went to Tom and Mary's last night.,iwe ntt  ot onamdmaly zr as  tm ikht
Why is Erdogan losing?,riancr isis
I've been offered a job in Australia.,iworgedina ustral iaforth ree ye ar s
Sami was shaking Layla's bed.,s aniwasshakingl ayl a sped
They'll be glad they did that.,the yrl
Are you going to let him insult your mother like that?,arey ougoi ngt oled himim sul t yourmot hellik e that  w
I've never stopped loving Tom.,iv eneverst oppe dlofimgt om
There are no fewer than a dozen bedrooms in this mansion.,er ea ren ofewelth an ado zembedr o oms i nthizmansion
I thought that everybody here was a vegetarian., oukhd thate fe lybodyherewaz afekedar ian  isthed
That's what works.,d hatworkedwel r
What the teacher said made Mary break out into a cold sweat.,edvro mtoin gthad w hadtheteac h ers aidn  adem alybreakou tim to a
Tom bought a new pick-up.,t ompo ugh tsomegoats
Maybe we should try looking inside.,nay pe weshouldtrylo okin kinz ide
Could we go somewhere and talk?, one wh ere antdalk  c an wetalkh ele
"Created four decades ago as an economic grouping, ASEAN ratified its charter last December in an effort to expand its influence in Asian and global affairs.",crea tet vou r de cade sakoas a necononickloupi nkase anl a tifietit schal  t ellaztt ecempe rima nefvorttoe xpa ndidsinvr  uenceinaz ianamt gropa  rafvairs
You're probably too young to understand this., plytooyoun gtoun derzt  a ndthis
Don’t put small animals in the microwave!,to n’t  putzm allanimalsinthenic row ave
She never explained why she was late.,z he mevelexp
I was going to tell the truth., az go  ingt odel rthetruth  te rlm edhed lu dhat once
Sami called to find out about Layla's tests.,zami c arre dtovimd ou tabou drayr astestz
It's clear that we're going to the church.,igopyd ha dc hurc heve ry tay
Can Algeria achieve bigger economic growth?,alger iaach iefepik kerecomomicklo wth  isalgeriaam
Sami kept on watching., ig epdomwad ching
I know that you have it.,i gme w youwerelyi mg
I didn't know that Tom knew who was going to help Mary do that.,ne wwho wa skoi mgtoh elbmalyd othad  ididm tk
"Now that we're alone, let's have fun.",n owthatwe realone   letsha fef um
Pietro finally went back to the room and began to wind down.,p iet rofinarly  w entbac gdo th eroom   antbegandowintd own
John is my best friend.,ton wasm ybez tvr ient
Mary has always been a model student.,maryiza studend leplesen tati ve maryh asal wayz beem  anodelz tute
Fadil died just weeks after his brother.,fadi rdie djus tw  eeksa vterhisbrodher
We will eat here.,comeover hel e
Yanni's phone is probably in the garbage.,yannizbho nei zbrob abryi nt
Bad days do happen.,dh eweath el isfimedo day
I don't like wearing a watch.,t  likewe alimk awatch  ito ndl ikemyc o vfeeho
Mennad was the first person that noticed the difference in Baya.,m en n adism utzapoutpaya men nad was dhef irsdp erso ndh at  modicetthetivfer ence
"Are you threatening me, Ziri?",are youdhle ateninkme z i
I want to be very clear about that.,id e fini teryto ntwanddoread  dhat
"To hear her speak English, you would take her for an Englishwoman.",to h e arh elsbeakengrishyou  wourdt akehel    folanengr izhwomam
I should have waited until Tom got here to do that.,ishou l tha vewai ted  untilto mkodh  eletot othad
We hid., d
I just happened to be there at that time.,i juzd  habbene  dtobet heleatt had dime
We were lovers.,
"He has no knowledge, not to mention experience.", oknowl etg e nottomen diomexbelienc e
I've never asked anyone for money.,i feneferasg edan yo mefor money  immodo bzesze
"What should we do now, Jamal?",ikno wm ow whadw e hafe do do w hats houldweto mowj
He's as happy as a king.,he is ac ompledemonarc h
Sami is going to know.,tokn ow
I told Tom he shouldn't go to Boston with Mary.,idoldt o mhe zhourd m tgot o boston w i  thmary
If he knows that we're here he'll kill us.,ivheknow sdh adwe r  eh elehelrg irl us
Are you going to tell Tom and Mary what they have to do or should I?,a le you goi ngtotell t o  namdn alywhad they have  t odoolshoul di
I doubt that Tom is still homeless.,i tou btt  had do misstillhomerezz
This is unbearable!,i sunbearaple  itzgro tesque
The bill passed the Diet.,sa n iw azo nadied dhepi rlp a zzed
She rushed inside.,sheslip ped
I can't see her anywhere.,i have mtvountid anywher e
I didn't yell at Tom.,rtom ididm dye r lad t
You should have said no.,ouzhoul th ave saidn o
"I fear that this generation will never appreciate those moments where we can physically spend time together, and not just through a screen.",e d om dhavetime dod o dhad ife alt hatth i sgene lat io mwirlmeve labp re ciatethoze mom emt swh ere wecanphy sicalryspendt  im etokedher a mdmotjuztthlou ghascreen
It's like hearing your soul sing., tz like healinky oursoulz imk  id
I told Tom that it was a risk.,ito rddom  thadi  twa sa riz  g
This new design is much better than the old one.,th isnewdesig ni smu  chb ett erdham the oltone
I thought that we played well.,dho ukht tha twebl aye twelr  id houg htth atwa zakoodd eal
I will not want to redo it.,eadmyzerv iwill motwan tto 
That worked well.,atwolk e twelr  dhadwa
Take Tom out immediately.,tageto nout innediate l
I think that Tom would be unfazed by that.,it hinkd onwo urdbeastoni s het
Jonas told Amelia to go to the back door.,eliadog o t othep ac ktool  l e on alri ved
We heard about the killing of his children in Jos.,yanmih e aldarus d lin gimth epuzhez
Tom has worked very hard.,tly tonh aswo rge dv
Tom refused to tell me anything.,dom znodde llingmes o methimk to nrefusedt oter l
We're trying our best to do that.,we retlyin kou r bezt tot othat  we cam
A small rock was thrown into our camp.,azn a l rr ockwasd hr owm imtoour camp
Tom and I are both music majors.,tona nd  ifebodhbee nv ery pusy
We're from Australia.,vron auztra lia  wecome vlon bri dain
You've been making too many mistakes recently.,youv e  beenmaking toomanymistage sre c emtry
Could you please leave?,i geepyouconb am y couldyo uble as ereav
I don't want to study.,ty
Jugurtha visited Bocchus without an armed personal guard.,j ugu rthaf isitedbocc huzwith ouda na rmedbersonalguald
When was the last time you cooked a meal?,w henwas d  helasdt imeyous repti  nadent 
He's pretty bad at tennis.,he  spledtybad atd enniz  he
Under Europa's icy crust might be an ocean of water.,om e fivthovtheeart h zsulfa ceiscove redbyper mafr ozt
Tom suffered from bone cancer.,tom di etv ro mhizinjuliez
They still communicate with each other.,theyen teredintoconversa t ion
